{
  "$schema": "../../schemas/beratung.schema.json",
  "demo_modus": true,
  "ersteller": "Seitenschwung",
  "name": "Gruppe 42",
  "firma": "Gruppe 42 e.U.",
  "kurzbeschreibung": "Personalentwicklung, Unternehmenskultur und Employer Branding aus Wien. Workshops und Programme für Führungskräfte, Mitarbeitende, Lehrlinge und Teams, seit 2002.",
  "website_url": "",
  "kontakt": {
    "telefon": "+43 699 111 59 870",
    "email": "info@gruppe42.at",
    "adresse": { "strasse": "Engerthstraße 156A/8/32", "plz": "1020", "ort": "Wien", "land": "Österreich" }
  },
  "hero": {
    "kicker": "Seit 2002 · Personalentwicklung aus Wien",
    "titel": "Menschen, die *gern* zur Arbeit kommen.",
    "text": "Wir unterstützen Unternehmen dabei, ein Umfeld zu schaffen, in dem Mitarbeitende sich morgens auf die Arbeit freuen, ihr Bestes geben und abends erfüllt nach Hause gehen.",
    "bild": { "datei": "hero.jpg", "alt": "Teilnehmende hören bei einem Workshop in einem hellen Altbau-Raum aufmerksam zu", "credit": "Timur Shakerzianov / Unsplash", "fokus": "center 45%" }
  },
  "zahlen": [
    { "wert": "35 Jahre", "text": "Berufserfahrung in Wirtschaft, Politik und Bildung" },
    { "wert": "24 Jahre", "text": "selbständig in Beratung, Training und Mediation" },
    { "wert": "19 Jahre", "text": "Lehrtätigkeit am FH Campus Wien" },
    { "wert": "25+", "text": "praxiserprobte Workshops und Programme" }
  ],
  "referenzen": {
    "titel": "Unternehmen und Institutionen, die mit uns arbeiten",
    "namen": ["ÖBB", "PORR", "AMS", "Opel Wien", "MAN", "RBI Group IT", "FH Campus Wien", "Wittmann Battenfeld", "Ardex", "Bildungsdirektion Wien", "Sozialministerium", "lawyers & more"]
  },
  "haltung": {
    "kicker": "Unsere Haltung",
    "text": "Wir glauben an eine Arbeitsplatz-(R)Evolution: Menschen arbeiten, nicht weil sie müssen, sondern *weil sie wollen.*",
    "nebentext": "Menschen verlassen selten ein Unternehmen. Sie verlassen ihre Führungskräfte. Deshalb setzen wir dort an, wo Kultur entsteht: bei Haltung, Kommunikation und Führung."
  },
  "geschichte": {
    "kicker": "Unsere Geschichte",
    "titel": "Erfahrung aus 35 Berufsjahren. Für Ihr Unternehmen.",
    "text": "Von der Europapolitik in Wien, Brüssel und Linz in die Personalentwicklung: Gruppe 42 verbindet den Blick für Organisationen und Institutionen mit über zwei Jahrzehnten Praxis in Training, Beratung und Mediation.",
    "qualifikationen": [
      "Wirtschaftsstudium, Universität Linz",
      "Studienlehrgang Training und Bildungsmanagement, Universität Linz",
      "Human Resources Management, Open University",
      "Ausbildung zur Mediatorin",
      "Mitglied der WKO Wien, Fachgruppe Unternehmensberatung"
    ],
    "stationen": [
      { "jahr": "1991", "titel": "Europapolitik in Wien", "text": "Assistentin in der Österreichischen Gesellschaft für Europapolitik." },
      { "jahr": "1993", "titel": "Brüssel", "text": "Assistentin bei der EFTA Surveillance Authority." },
      { "jahr": "1995", "titel": "Linz", "text": "EU-Referentin am Institut für Sozial- und Wirtschaftswissenschaften." },
      { "jahr": "1998", "titel": "Europäisches Parlament", "text": "Parlamentarische Mitarbeiterin von Dr. Maria Berger, Abgeordnete zum EU-Parlament." },
      { "jahr": "2002", "titel": "Der Schritt in die Selbständigkeit", "text": "Unternehmensberaterin, Mediatorin und Führungskräftetrainerin. Seither begleiten wir Unternehmen, Institutionen und ihre Menschen.", "hervorheben": true },
      { "jahr": "2007", "titel": "FH Campus Wien", "text": "Lektorin für Personalmanagement, Führungstraining und Kommunikation." },
      { "jahr": "2021", "titel": "Denkanstöße", "text": "Start des Blogs über Führung, Generationen und Unternehmenskultur." },
      { "jahr": "Heute", "titel": "Partnerin für Organisationen jeder Größe", "text": "Programme für Führungskräfte, Mitarbeitende, Lehrlinge und Teams, vom Familienbetrieb bis zu ÖBB, PORR und dem AMS." }
    ]
  },
  "leistungen": {
    "kicker": "Leistungen",
    "titel": "Drei Hebel für eine Kultur, in der Menschen bleiben.",
    "eintraege": [
      {
        "id": "personalentwicklung",
        "titel": "Personalentwicklung",
        "text": "Persönliche, methodische und Beziehungskompetenzen stärken, von der Führungsebene bis zum ersten Lehrjahr.",
        "schlagworte": ["Führungskräfte", "Mitarbeitende", "Lehrlinge", "Teams"],
        "bild": { "datei": "personalentwicklung.jpg", "alt": "Zwei Frauen im vertraulichen Gespräch an einem Tisch am Fenster", "credit": "Christina @ wocintechchat.com / Unsplash" },
        "link": "#zielgruppen"
      },
      {
        "id": "unternehmenskultur",
        "titel": "Unternehmenskultur",
        "text": "Vision und Werte, die gelebt werden. Eine Kommunikation, die Vertrauen schafft. Führung, die begeistert.",
        "schlagworte": ["Vision & Werte", "Kommunikation", "Führung"],
        "bild": { "datei": "kultur.jpg", "alt": "Drei Kolleg:innen lachen gemeinsam am Laptop", "credit": "Brooke Cagle / Unsplash" },
        "motto": "Überlassen Sie Ihre Kultur nicht dem Zufall.",
        "intro": "Der Schlüsselfaktor für Wettbewerbsfähigkeit ist und bleibt der Mensch. Eine starke Unternehmenskultur schafft Rahmenbedingungen, in denen sich Menschen zu engagierten, innovativen und loyalen Mitarbeitenden entwickeln. Wir unterstützen Sie dabei, Ihre einzigartige Kultur und Identität zu stärken und zum Leben zu erwecken.",
        "abschnitte": [
          { "titel": "Vision und Werte", "untertitel": "Geben Sie Ihren Mitarbeitenden einen Grund aufzustehen.", "text": "Mit einer klaren Vision und gelebten Werten zeigen Sie, wofür Sie stehen und was Sie antreibt. Damit werden Sie unverwechselbar, sichtbar und attraktiv: für Menschen, die Ihre Produkte kaufen, und vor allem für jene, die für Sie arbeiten." },
          { "titel": "Kommunikation", "untertitel": "Vertrauen und Verbundenheit schaffen.", "text": "Ihre Unternehmenskultur spiegelt sich darin, wie Menschen miteinander sprechen. Wir unterstützen Sie, eine gesunde Kommunikationskultur zu schaffen, im persönlichen Umgang ebenso wie in digitalen Medien." },
          { "titel": "Führung", "untertitel": "Führungskräfte, die Menschen begeistern.", "text": "Nichts prägt Ihre Kultur stärker als Ihre Führungskräfte. Wir begleiten Sie auf dem Weg zu Führungskräften, denen Mitarbeitende folgen, nicht weil sie müssen, sondern weil sie wollen." }
        ]
      },
      {
        "id": "employer-branding",
        "titel": "Employer Branding",
        "text": "Eine Arbeitgebermarke, die die Wahrheit sagt. Von der Strategie über die Verankerung bis zur laufenden Betreuung.",
        "schlagworte": ["Strategie", "Implementierung", "Management"],
        "bild": { "datei": "employer-branding.jpg", "alt": "Team feiert im Besprechungsraum mit einem High five vor einer Wand mit Haftnotizen", "credit": "Walls.io / Unsplash" },
        "motto": "Attraktiv für bestehende und zukünftige Mitarbeitende.",
        "intro": "Neue Erwartungen, ein Wertewandel zwischen den Generationen und der Wettbewerb um Fachkräfte verlangen eine glaubwürdige Arbeitgebermarke. Sie entsteht nicht in einer Werbekampagne, sondern aus Ihrer gelebten Unternehmenskultur. Es geht darum, authentisch zu sein, statt nur zu sagen, dass man es ist.",
        "abschnitte": [
          { "titel": "Strategie", "untertitel": "Klar und unverwechselbar positioniert.", "text": "Analyse der bisherigen Arbeitgeberpositionierung und Arbeitskultur, Entwicklung der Employer-Branding-Strategie mit Werten, Leitbild, Zielgruppen und Maßnahmen, festgehalten in einem Employer Branding Manual." },
          { "titel": "Implementierung", "untertitel": "Innen verankert, außen sichtbar.", "text": "Verankerung durch Trainings, Workshops und Coachings, bessere Arbeitskultur, interne Kommunikation und ein stimmiger Auftritt nach außen gegenüber Ihren Zielgruppen." },
          { "titel": "Employer Branding Management", "untertitel": "Damit die Marke lebendig bleibt.", "text": "Klare Zuständigkeiten, Planung von Inhalten, Maßnahmen und Kommunikation. Auf Wunsch übernehmen wir das Management oder begleiten Sie als Sparringpartner." }
        ]
      }
    ]
  },
  "zielgruppen_kopf": { "kicker": "Für wen", "titel": "Workshops und Programme für jede Ebene." },
  "zielgruppen": [
    {
      "id": "fuehrungskraefte",
      "titel": "Führungskräfte",
      "motto": "Sei die Führungskraft, die du dir *gewünscht* hättest.",
      "teaser": "„Sei die Führungskraft, die du dir gewünscht hättest.“",
      "intro": "Wenn Mitarbeitende kündigen, verlassen sie meist nicht das Unternehmen, sondern ihre Führungskraft. Selten fehlt es an Fachwissen. Der Schritt in die Führung ist ein Wechsel vom Fachexperten zum Menschenexperten.",
      "bild": { "datei": "fuehrungskraefte.jpg", "alt": "Eine Führungskraft spricht vor ihrem Team am langen Besprechungstisch", "credit": "Christina @ wocintechchat.com / Unsplash" },
      "workshops": [
        { "kategorie": "Selbstkompetenz", "titel": "Führung, eine Frage der Haltung", "text": "Die eigene Grundhaltung kennen und authentisch mit der Führungsrolle verbinden.", "dauer": "2 Tage" },
        { "kategorie": "Selbstkompetenz", "titel": "Rolle und Aufgabe als Führungskraft", "text": "Das eigene Führungsverhalten reflektieren und die persönlichen Potenziale als Führungskraft erkennen.", "dauer": "2 Tage" },
        { "kategorie": "Beziehungskompetenz", "titel": "Kommunizieren, Beziehungen stärken", "text": "Offen, klar und wertfrei kommunizieren, aufmerksam zuhören und die eigene Position vertreten.", "dauer": "3 Tage" },
        { "kategorie": "Beziehungskompetenz", "titel": "Schwierige Gespräche führen", "text": "Kritik formulieren, ohne zu verletzen. Konflikte früh erkennen und gemeinsam lösen.", "dauer": "2 Tage" },